{"schemaVersion":4,"exportedAt":"2026-09-07T00:00:00Z","sourcePlatform":"test","sourceInstallationId":"00000000-0000-4000-8000-000000000001","members":[{"uuid":"10000000-0000-4000-8000-000000000001","name":"张女士","nickname":"母亲","relationship":"母亲","archived":false,"createdAt":"2026-09-01T00:00:00Z","updatedAt":"2026-09-01T00:00:00Z"}],"conditions":[{"uuid":"20000000-0000-4000-8000-000000000001","name":"鼻窦炎","color":0,"notes":"","archived":false,"createdAt":"2026-09-01T00:00:00Z","updatedAt":"2026-09-01T00:00:00Z","memberUuid":"10000000-0000-4000-8000-000000000001"}],"records":[{"uuid":"30000000-0000-4000-8000-000000000001","conditionUuid":"20000000-0000-4000-8000-000000000001","recordDate":"2026-09-03","title":"鼻窦炎复查","stage":"CHECKUP","symptoms":"鼻塞减轻","diagnosis":"鼻窦炎","treatment":"继续冲洗","medicationNotes":"","hospital":"测试医院","clinician":"李医生","notes":"原文记录：\n9月3日复查鼻窦炎，鼻塞减轻。","createdAt":"2026-09-03T00:00:00Z","updatedAt":"2026-09-03T00:00:00Z","memberUuid":"10000000-0000-4000-8000-000000000001","dayOrder":0}],"attachments":[],"followUps":[],"occurrences":[],"medications":[{"uuid":"40000000-0000-4000-8000-000000000001","name":"测试药物","doseAmount":"1","doseUnit":"片","instructions":"饭后","startDate":"2026-09-01","mode":"SCHEDULED","archived":false,"createdAt":"2026-09-01T00:00:00Z","updatedAt":"2026-09-05T00:00:00Z","memberUuid":"10000000-0000-4000-8000-000000000001"}],"medicationSchedules":[{"uuid":"50000000-0000-4000-8000-000000000001","medicationUuid":"40000000-0000-4000-8000-000000000001","localTime":"08:05","enabled":true,"updatedAt":"2026-09-05T00:00:00Z","effectiveFrom":"2026-09-01","doseAmountSnapshot":"1","doseUnitSnapshot":"片"}],"medicationLogs":[{"uuid":"60000000-0000-4000-8000-000000000001","medicationUuid":"40000000-0000-4000-8000-000000000001","scheduleUuid":"50000000-0000-4000-8000-000000000001","scheduledAt":"2026-09-03T08:05","actualAt":"2026-09-03T08:10","status":"TAKEN","doseAmountSnapshot":"1","doseUnitSnapshot":"片","createdAt":"2026-09-03T08:10:00Z","updatedAt":"2026-09-03T08:10:00Z"}]}
